query,expected_context,ground_truth_answer
Describe Sona's childhood at the Ionian monastery.,Early Life and Upbringing,"Sona was left at a monastery in Ionia as an infant and raised by monks. She learned to play a mysterious instrument and brought comfort to other children, though she was unable to speak."
What psychological impact did Sona's inability to speak have on her interactions?,Social Interaction and Communication,"Despite her inability to speak, Sona's thoughtful nature brought comfort to the other children, making them smile when she was around."
What is Sona's primary role or profession?,Occupation and Role,Sona is a musician and a virtuoso.
What species is Sona Buvelle?,Species Identification,Sona is human.
How did Sona's discovery of music in Ionia lead to her adoption by House Buvelle in Demacia?,Musical Journey and Adoption into Demacia,"Left in an Ionian monastery as an infant with a mysterious instrument, Sona taught herself to play it, developing her musical talent. This talent likely drew the attention of House Buvelle, leading to her adoption and relocation to Demacia."
"What role did Sona's adoptive mother, Lestara, play in her life after adoption into House Buvelle?",Adoptive Mother's Role in House Buvelle,Lestara Demoisier-Buvelle is Sona's adoptive mother and a member of House Buvelle in Demacia.
Tell me about Sona's sister.,Familial Relationships - Sister,Sona has an adoptive sister named Kahina Buvelle.
Who were Sona's parents?,Parental Identity - Biological vs. Adoptive,"Sona's biological parents are unknown, as she was left at an Ionian monastery. She was later adopted by Barrett Buvelle and Lestara Demoisier-Buvelle."
What are Soraka's celestial weapons?,Weapons,Soraka wields a Celestial Staff and utilizes Star Magic and Healing Magic.
In which regions does Soraka primarily reside?,Residence and Region,"Soraka resides in the Astral Grove and Mount Targon, and is also associated with Ionia."
List the characters known to be related to Soraka.,Related Characters,"Characters related to Soraka include Alune, Aphelios, Aurelion Sol, Bard, Diana, Kalista, Leona, Pantheon, Taric, and Tyari."
What is the name of Soraka's pet?,Pet,Soraka's pet is named Stellacorn.
Why did Soraka choose to descend to the mortal realm?,Motivation for descending,Soraka descended because she and other celestials were concerned about the mortals' growing suffering due to misinterpreting celestial guidance.
What observations did the celestials make about the early inhabitants of Runeterra?,Celestial observations of Runeterra,"The celestials observed the fledgling races of Runeterra with concern, noting their tendency to misinterpret celestial fates, leading to chaos and suffering."
What was Soraka's primary objective when she first came to Runeterra?,Soraka's initial objective,Soraka's primary objective was to untangle the knots in the tapestry of the world and soothe the mortals she encountered.
How did mortals often interact with the guidance provided by the stars?,Mortal interpretation of celestial guidance,"Mortals often misinterpreted the guidance and fates woven by celestials into constellations, leading to chaos, uncertainty, and suffering."
"Considering Soraka's celestial origin and her role as a seer, how might her understanding of fate contrast with that of mortals in Ionia?",Celestial vs. Mortal perspective on fate and suffering in Ionia,"As a celestial seer, Soraka could perceive the cosmic threads of fate and understand the root causes of suffering, offering a divine perspective. Mortals in Ionia, however, would experience suffering directly, possibly without understanding its divine origins or their own role in misinterpreting fate."
How does Soraka's mission as a traveling healer in Ionia reflect her early concerns about mortal suffering?,Soraka's healing mission and early concerns,"Soraka's early concerns about mortal uncertainty and suffering, caused by misinterpretations of celestial guidance, directly motivated her to become a traveling healer in regions like Ionia, actively intervening to soothe and guide mortals."
Who betrayed Soraka?,Betrayal,There is no mention in Soraka's lore of her being betrayed.
In which regions does Soraka primarily reside?,Residence and Region,"Soraka resides in the Astral Grove and Mount Targon, and is also associated with Ionia."
List the characters known to be related to Soraka.,Related Characters,"Characters related to Soraka include Alune, Aphelios, Aurelion Sol, Bard, Diana, Kalista, Leona, Pantheon, Taric, and Tyari."
What is the name of Soraka's pet?,Pet,Soraka's pet is named Stellacorn.
Why did Soraka choose to descend to the mortal realm?,Motivation for descending,Soraka descended because she and other celestials were concerned about the mortals' growing suffering due to misinterpreting celestial guidance.
What observations did the celestials make about the early inhabitants of Runeterra?,Celestial observations of Runeterra,"The celestials observed the fledgling races of Runeterra with concern, noting their tendency to misinterpret celestial fates, leading to chaos and suffering."
What was Soraka's primary objective when she first came to Runeterra?,Soraka's initial objective,Soraka's primary objective was to untangle the knots in the tapestry of the world and soothe the mortals she encountered.
How did mortals often interact with the guidance provided by the stars?,Mortal interpretation of celestial guidance,"Mortals often misinterpreted the guidance and fates woven by celestials into constellations, leading to chaos, uncertainty, and suffering."
"Considering Soraka's celestial origin and her role as a seer, how might her understanding of fate contrast with that of mortals in Ionia?",Celestial vs. Mortal perspective on fate and suffering in Ionia,"As a celestial seer, Soraka could perceive the cosmic threads of fate and understand the root causes of suffering, offering a divine perspective. Mortals in Ionia, however, would experience suffering directly, possibly without understanding its divine origins or their own role in misinterpreting fate."
How does Soraka's mission as a traveling healer in Ionia reflect her early concerns about mortal suffering?,Soraka's healing mission and early concerns,"Soraka's early concerns about mortal uncertainty and suffering, caused by misinterpretations of celestial guidance, directly motivated her to become a traveling healer in regions like Ionia, actively intervening to soothe and guide mortals."
Who betrayed Soraka?,Betrayal,There is no mention in Soraka's lore of her being betrayed.
What is Soraka's connection to the Void?,Factional affiliation,Soraka is a celestial being and her lore does not indicate any connection to the Void.
What are Sylas's primary weapons?,List of equipped items or combat tools.,"Petricite Restraints, Petricite Chains, Absorption Magic, Sensory Magic"
From which region does Sylas hail?,Geographical or political origin.,Demacia
List characters closely related to Sylas in Demacian politics.,"Political alliances, rivalries, or familial ties.","Jarvan IV, Garen, Lux"
What factions is Sylas a part of or has been associated with?,Organizational affiliations.,"Rebels of Zeffira, Winter's Claw, Mageseekers"
What events or observations led Sylas to distrust Demacian authorities?,Psychological motivations and historical influences.,"He witnessed the hypocrisy of magic use among the elite and the harsh punishment of the poor, making him doubt Demacia's ideals."
Describe Sylas's early life and his initial dealings with the Mageseekers.,Biography and historical background.,"Born to a poor family in Demacia, Sylas had magical abilities and was given to the Mageseekers, who used him to identify other mages, leading him to observe Demacian hypocrisy."
What was Sylas's core motivation for starting a revolution?,Ideological drivers and personal convictions.,His desire to expose Demacia's hypocrisy regarding magic use and fight against the oppression of mages.
What role did Sylas's family play in his early life?,Family background and influences.,"Sylas was born to a poor family who, believing magic was an affliction, convinced him to surrender himself to the Mageseekers for a better life."
"Considering his history in Demacia, how does Sylas's current situation in the Freljord reflect his revolutionary ideals?","Combining lore, political context, and character motivation.","Sylas's experiences with Demacian hypocrisy and oppression fuel his revolutionary zeal, which he now applies in the Freljord to challenge existing powers and seek justice for mages, potentially aligning with factions like Winter's Claw."
Explain how Sylas's Petricite Restraints serve as both a symbol of his oppression and a tool for his rebellion.,"Connecting lore, character abilities, and thematic elements.","Initially used by the Mageseekers to control and imprison him, Sylas learned to absorb and manipulate petricite magic, turning these restraints into the very weapons he uses to fight against Demacia."
Who is known as the 'Traitor' who opposes the Mageseekers in Demacia?,Ambiguous identity linked to a nickname.,Sylas
"Sylas is a known rebel. Which key figure from Demacia's ruling family does he frequently clash with, and what is the root of their conflict?",Political opposition and familial conflict.,"Sylas frequently clashes with Jarvan IV and Garen, due to his revolutionary actions against Demacian mageseeker policies and his past as the \""Kingslayer\"" who overthrew Jarvan III."
What are Syndra's primary weapons?,Direct lookup from infobox,"Dark Spheres, Force of Will"
In which region of Runeterra does Syndra primarily reside?,Direct lookup from infobox,Ionia
Who was Syndra's brother mentioned in her early life?,Specific family member mentioned in lore,Evard
List characters related to Syndra.,Direct lookup from infobox,"Irelia, Karma, LeBlanc"
What caused Syndra to manifest her dark magic?,Lore snippet about her childhood rage and bullying,Syndra manifested her dark magic due to intense rage and torment from her brother and his friends after being bullied.
Describe Syndra's early life and the circumstances of her powers manifesting.,Full lore snippet,"Syndra was born in Navori, Ionia, and experienced harsh punishments for her distracted nature. During a confrontation with her brother Evard and his friends, her rage caused three luminous orbs to materialize, withering a sacred willow tree and leading her village to blame her family."
What happened to the Spectral Willow after Syndra's powers manifested?,Lore snippet about the willow,The Spectral Willow withered and died after Syndra's powers manifested due to her uncontrolled magic.
Where did Syndra seek solace during her childhood?,Lore snippet about her hideout,"Syndra sought solace in the Spectral Willow, her secret hideout."
What event in Ionia led to Syndra's family being blamed for the demise of a sacred tree?,Combining region (Ionia) with the lore event of the willow withering,"Syndra's uncontrolled manifestation of dark magic, fueled by rage during a childhood torment, caused the Spectral Willow to wither, leading her Ionian village to blame her family."
How did Syndra's interaction with her brother Evard and his friends contribute to her notoriety?,Linking the relationship with her brother to the consequence of her powers emerging and the village's reaction,"When Syndra's brother Evard and his friends taunted her, her intense rage caused her dark magic to manifest, resulting in the wilting of the village's vital Spectral Willow and subsequent blame cast upon her family."
What happened to Syndra's older brother?,Testing direct resolution of family members mentioned in lore,"Syndra's brother, Evard, and his friends tormented her, leading to her rage and the manifestation of her powers, which caused the Spectral Willow to wither, resulting in her family being blamed by the village."
Who betrayed Syndra in her village?,Testing for explicit mentions of betrayal vs. implied blame,"The provided lore does not explicitly mention anyone betraying Syndra in her village. However, after her powers caused the Spectral Willow to wither, the village collectively blamed Syndra's family."
What weapons does Tahm Kench use?,Infobox,"Tongue, Teeth"
In which region does Tahm Kench primarily reside?,Infobox,Runeterra
List characters related to Tahm Kench.,Infobox,"Fiddlesticks, Evelynn, Fizz, Nautilus, Aatrox, Kalista, Janna, Jack"
What is Tahm Kench's main occupation?,Infobox,"Crossroads Demon, Demon of Addiction"
Describe Tahm Kench's personality and nature.,Lore Snippet/Aliases,"Tahm Kench embodies addiction and despair, a malevolent demon who preys on souls by offering dark bargains."
What is the general historical timeline of Tahm Kench?,Lore Snippet/Age,"Tahm Kench is ancient, having existed for at least 9996 years, likely predating much of recorded Runeterran history."
Can you describe Tahm Kench's physical appearance?,Lore Snippet,"Tahm Kench is a large, rotund, catfish-like humanoid with a massive mouth, rows of fangs, a prehensile tongue, shiny green skin, and yellow eyes. He often wears ill-fitting gentleman's clothes."
What are the implications of Tahm Kench being a 'Demon of Addiction'?,Lore Snippet/Aliases,"As a 'Demon of Addiction,' Tahm Kench likely preys on the desires and weaknesses of mortals, drawing them into ruin through tempting, yet ultimately destructive, pacts."
"What is Tahm Kench's role as a demon in Runeterra, and what is his primary tool for devouring souls?",Region & Weapon,"In Runeterra, Tahm Kench is a Crossroads Demon of Addiction, and he uses his prehensile tongue to devour souls."
"Considering his association with other demons like Fiddlesticks, what does Tahm Kench offer to those who make a deal with him?",Related Characters & Occupation,"Tahm Kench, associated with other demons, offers to fulfill desires and alleviate despair, but his 'deals' invariably lead to ruin for those who accept."
Who is Tahm Kench's older brother?,Character Relationships,There is no known information about Tahm Kench having a brother.
Who is the greatest traitor Tahm Kench fears?,Character Role/Motivation,"Tahm Kench is described as a demon of addiction and despair, not as someone who fears a specific traitor; he himself often facilitates betrayal through his dark bargains."
What are Taliyah's main magical abilities or weapons?,Abilities/Skills,Taliyah's primary ability is Stone Magic.
Where was Taliyah originally from?,Place of origin,"Taliyah was born in the south of Shurima, near the border of Icathia."
Who is Taliyah's grandmother?,Family relationships,Taliyah's grandmother is Babajan.
Name three characters closely associated with Taliyah.,Character relationships,"Taliyah is associated with champions like Yasuo, Azir, and Nasus."
Describe Taliyah's childhood and upbringing with the Naasaj tribe.,Lore/Biography,"Taliyah was born in southern Shurima to the nomadic Naasaj tribe, who were weavers and herders. She was taught to appreciate the desert but was most fascinated by the rocks."
What pivotal event occurred when Taliyah was six years old that revealed her powers?,Childhood events/Lore,"When Taliyah was six, she followed a goatling to a cliff. The stone called to her, and it erupted, causing a rockslide."
What was the primary occupation of Taliyah's nomadic tribe?,Cultural background/Lore,"Taliyah's tribe, the Naasaj, were known as nomadic weavers and herders."
How did Taliyah perceive the desert environment during her youth?,Personal feelings/Lore,"Although Taliyah was taught to appreciate the desert's beauty, she was always more interested in the rock beneath it."
"Considering Taliyah's origin in southern Shurima and her tribe's nomadic lifestyle, what event in her childhood first demonstrated her unique control over stone?","Southern Shurima, Naasaj tribe, Childhood event, Stone control","During her childhood in southern Shurima, while tending to a goat, Taliyah experienced a significant event where the stone of a cliff erupted in response to her touch, revealing her unique stone-weaving abilities."
How did Taliyah's upbringing in the Naasaj tribe near Icathia shape her early fascination with stone magic?,"Shurima, Icathia, Naasaj tribe, Stone Magic, Early Life","Growing up as a nomadic weaver and herder in the Naasaj tribe near the Icathian border in Shurima, Taliyah developed a deep connection with the land, particularly the rocks, which led to her fascination with stone magic."
Does Taliyah have an anh trai?,Family relationships,"Taliyah's family includes her father, mother, and grandmother Babajan, but no mention of an older brother (anh trai) is made in her lore."
Is Taliyah known as a kẻ phản bội?,Character reputation/Lore,There is no information in Taliyah's lore that describes her as a kẻ phản bội (traitor). Her narrative focuses on her journey and mastery of stone magic.
What weapons does Talon use?,List of equipment,"Talon uses Arm Blades, Circular Daggers, and Double-Edged Blades."
In which region is Talon primarily associated with?,Geographic origin and current residence,"Talon is primarily associated with Noxus, though he has also resided in Shurima."
Who are Talon's adoptive family members?,Family tree information,"Talon's adoptive family includes Marcus Du Couteau, Soreana Du Couteau, Katarina Du Couteau, and Cassiopeia Du Couteau."
Which faction does Talon belong to?,Faction information,Talon belongs to House Du Couteau and the Black Rose faction.
Why did Talon choose to serve General Du Couteau?,Early life and his encounter with Du Couteau,"Talon chose to serve General Du Couteau because he could only respect orders from those he could not defeat, and Du Couteau bested him in a duel."
What was Talon's life like before he was discovered by General Du Couteau?,Early life in Noxus,"Before being discovered by General Du Couteau, Talon lived as an orphan thief in the underbelly of Noxus, surviving by his wits and navigating underground passages."
What is Talon's general demeanor or attitude towards authority?,His choice to serve Du Couteau and his past,"Talon exhibits a stoic and pragmatic demeanor, only respecting those he deems worthy of his service through their strength or skill. He is self-reliant and distrustful due to his harsh upbringing."
Does Talon remember his birth parents?,Early life description,"No, Talon has no recollection of his birth family."
"How did Talon's upbringing in Noxus shape his view on respect and authority, especially concerning General Du Couteau?","Early life in Noxus, encounter with Du Couteau","Talon's harsh upbringing as an orphan thief in Noxus taught him self-reliance and a deep distrust of others. This led him to value strength and respect only those who could defeat him, which is why he chose to serve General Du Couteau after being bested in a duel."
"Considering Talon's skills as an assassin and his association with Noxus, what is his likely role in the Black Rose faction's schemes?","Talon's occupation, faction, and origin","As an assassin associated with Noxus and the Black Rose, Talon likely serves as an operative for clandestine missions and political assassinations, leveraging his mastery of blades and underground knowledge to carry out the faction's objectives."
Who is Talon's uncle?,Family relationships,"Talon's family information lists his adoptive parents and adoptive sisters, but no uncle is mentioned."
Tell me about the traitor in Talon's family.,"Family, lore snippets","The provided lore does not explicitly mention a traitor within Talon's immediate family, though his adoptive father Marcus Du Couteau is marked as deceased (†). The 'Betraying Katarina' snippet is incomplete."
What are Taric's primary weapons?,Weapons,Taric wields Bravado and Bastion.
What regions is Taric primarily associated with?,Regions,Taric is associated with Targon and Demacia.
List the characters related to Taric.,Related Characters,"Taric is related to Kayle, Morgana, Garen, Leona, Diana, Aurelion Sol, Soraka, Tyari, Pantheon, and Zoe."
What was Taric's occupation before becoming an Aspect?,Occupation,"Before becoming an Aspect, Taric served as a Dauntless Vanguard Knight."
How did Taric's upbringing in Demacia influence his view on life and art?,Psychology/Beliefs,"Taric believed that art and life alike made Demacia worth fighting for, and he found value in protecting and contributing to his homeland in various ways."
Describe Taric's early life and training in Demacia.,History/Past Events,"Taric was born and raised in Demacia, showing great martial prowess during his military training, while also volunteering his time to help others and rebuild."
What values did Taric hold regarding Demacia?,Beliefs/Values,"Taric believed that art and life made Demacia worth fighting for, and he dedicated himself to protecting and serving his homeland."
What is Taric's role as the Aspect of the Protector?,Role/Purpose,"As the Aspect of the Protector, Taric is a guardian of the innocent and a champion of justice."
How did Taric's dedication to Demacia during his early life shape his later role as a Targon Aspect?,Demacian upbringing and Targon role,"Taric's deep-seated belief in protecting and contributing to his homeland, as shown in Demacia, likely informed his sense of duty and justice as the Aspect of the Protector on Mount Targon."
What is the connection between Taric's service in the Dauntless Vanguard and his current position on Mount Targon?,Demacian Faction and Targon Residence,"Taric's role as a Dauntless Vanguard Knight in Demacia reflects his disciplined, protective nature, which aligns with his current occupation as an Aspect on Mount Targon, where he continues to safeguard others."
Tell me about the betrayal Taric committed against the Aspects.,Alias 'Oathbreaker' and potential misinterpretation,"While Taric is sometimes referred to as an 'Oathbreaker', the provided lore highlights his role as a protector and Aspect, with no specific mention of him betraying the Aspects themselves."
"What is Taric's relationship with his older brother, and how did it affect his journey?",Non-existent familial relationship,The provided lore for Taric details his family's military tradition but makes no mention of an older brother influencing his path or journey.
What weapons does Teemo wield?,List weapons,"Teemo wields a blowgun, darts, Ajunta Poison, and Poison Puffcaps."
What region is Teemo from?,Region information,Teemo is from Bandle City.
Who are some characters related to Teemo?,Related characters,"Some characters related to Teemo include Yuumi, Tristana, Veigar, Rumble, Corki, Lulu, Graves, Twisted Fate, and Gnar."
What is Teemo's role in the Bandle Scouts?,Occupation/Faction,Teemo is the Scout Leader of the Bandle Scouts.
Describe Teemo's early career and rise in the Bandle Scouts.,History/Background,"Teemo began as a member of the Bandle Scouts, excelling in survival expertise, traveling across the material realm to earn badges, and eventually rising to become the new leader."
How did Teemo's leadership affect the Bandle Scouts?,Lore Snippet,"Teemo's diligence and enthusiasm inspired other yordles to join the Bandle Scouts, garnering awe across Runeterra."
What does Teemo wear and carry?,Appearance,"Teemo wears khaki gloves and boots, a furry red scarf, a telescope around his neck, and his signature hat with red goggles. He carries a backpack filled with maps and wields a blowgun with feathers."
What is Teemo's species and general description?,General Lore,"Teemo is a short yordle with beige fur and brown markings on his eyes, which are usually closed. He is known for his survival expertise and leadership in the Bandle Scouts."
How did Teemo's adventures across Runeterra contribute to his leadership in Bandle City?,Lore Snippet + Region,"Teemo's extensive travels across the material realm to earn Bandle Scout badges demonstrated his survival expertise, which led to his promotion to leader of the Bandle Scouts, inspiring others in Bandle City."
"What makes Teemo a good leader for the Bandle Scouts, considering his role with other yordles?",Lore Snippet + Related characters (general yordle community),"Teemo's diligence and enthusiasm as a scout, demonstrated by his achievements and travels, inspired other yordles to join the Bandle Scouts and led to his appointment as leader, earning him awe across Runeterra."
Who is considered a traitor within the yordle community?,"Generic term \""traitor\"",""The provided lore for Teemo does not specify a traitor within the yordle community."
What is the relationship between Teemo and his brother?,"Generic term \""brother\"",""Teemo's lore does not mention him having a brother."
What weapons does the Poro King wield?,List of weapons,"Scepter, 3 Horn"
What region is the Poro King associated with?,Region of origin,Runeterra
Who is Ingvar the Younger in relation to the Poro King?,Related characters,Ingvar the Younger owns a plush of the Poro King and acts as 'Poro Supervisor'.
Who is Bjerg the Wanderer in relation to Ingvar?,Related characters,Bjerg the Wanderer is Ingvar the Younger's uncle.
What is the Poro King's role or purpose in Runeterra?,Character's purpose/function,The Poro King is described as the protector of all peoples of Runeterra and the ruler of 'a gajillion trillion poros'.
What is known about the Poro King's origins or history?,Character's background,Not much is known about the Poro King's origins or history; evidence of his existence is a homemade plush owned by Ingvar.
What do people believe about the Poro King's existence?,Beliefs and perceptions,"Some believe he is real, the protector of Runeterra, while Ingvar's mother believes he is a figment of imagination."
Describe the Poro King's appearance.,Physical description,"The Poro King is a round white poro with a large white mustache and goatee, bushy eyebrows, a large red tongue, and curly dark brown horns."
