champion_name,query,expected_intent,expected_context,ground_truth_answer
Naafiri,What is Naafiri's current status and where does she reside?,Vector,Status and Residence,Naafiri is alive and currently has no fixed abode in Shurima.
Naafiri,Explain Naafiri's unique ability of Hemomancy.,Vector,Abilities and Magic,"Hemomancy is Naafiri's unique ability, likely related to blood magic or manipulation."
Naafiri,How did Naafiri's pride influence her actions during the Darkin War in Shurima?,Hybrid,Darkin War and Shurima's influence on Darkin actions,"Naafiri's pride led her to believe she could dominate other Darkin during the war in Shurima, reflecting her vainglorious nature."
Naafiri,What is the significance of Naafiri's Darkin Daggers in her role as a Shuriman Guardian?,Hybrid,"Darkin Daggers, Shuriman Guardian role","The Darkin Daggers are Naafiri's primary weapons, used in her capacity as a formidable Shuriman Guardian, likely for combat and hunting."
Naafiri,Does Naafiri have any siblings or brothers?,Adversarial,Family relationships,"The provided information lists 'Sister' as a nickname for Naafiri, and she is related to other Darkin like Aatrox and Varus, but no specific brother is mentioned."
Naafiri,What is the name of the traitor among the Darkin that Naafiri opposes?,Adversarial,Betrayal and opposition among Darkin,"While Naafiri considered herself powerful and there were clashes among Darkin, the provided lore snippet does not specify a particular 'traitor' that Naafiri opposes, though Xolaani is often depicted in adversarial roles with other Darkin."
Nami,What weapons does Nami wield?,Graph,List of Nami's weapons,Nami wields the Tidecaller Staff and uses Water Magic.
Nami,In which region does Nami primarily reside or originate from?,Graph,Geographical origin and residence of Nami,Nami originates from the Marai Territory on the coastline of Mount Targon.
Nami,Name some characters related to Nami.,Graph,Characters connected to Nami,"Characters related to Nami include Diana, Fizz, Nautilus, and Longtooth."
Nami,Who are Nami's romantic interests?,Graph,Romantic relationships of Nami,Nami's romantic interests are Tama and Loto.
Nami,What was Nami's lifelong ambition during her early life?,Vector,Nami's personal goals and aspirations,"Nami aspired to become the tribe's Tidecaller, a warrior responsible for finding a pearl in the deep sea."
Nami,Describe Nami's personality traits as a young Vastaya.,Vector,Nami's character and disposition,"Nami is described as stubborn and fierce, though this often led her into trouble."
Nami,What is the significance of the Tidecaller title for the Marai?,Vector,The role and duties of a Tidecaller,"The Tidecaller is a strong warrior chosen to find a pearl in the deep sea in exchange for a moonstone, which wards off dangerous creatures."
Nami,What is the Marai tribe's practice involving moonstones and pearls?,Vector,Cultural practices of the Marai tribe,"The Marai tribe exchanges a pearl found by the Tidecaller for a moonstone from humans, which they use to ward off deep-sea creatures."
Nami,"In the Marai Territory, what is the primary objective of Nami's quest when she becomes a Tidecaller?",Hybrid,The quest of the Tidecaller in relation to the Marai Territory,"As Tidecaller in the Marai Territory, Nami's quest is to find a pearl in the deep sea in exchange for a moonstone to protect her tribe."
Nami,"How do the Marai, Nami's species, utilize the moonstone they receive from humans?",Hybrid,The function of moonstones for the Marai species,The Marai use the moonstone to ward off dangerous creatures from the deep sea within their territory.
Nami,Who was the 'traitor' in Nami's story?,Adversarial,Identification of a traitor in Nami's narrative,The provided lore for Nami does not mention any specific 'traitor' or instances of betrayal.
Nami,Tell me about Nami's 'human relatives'.,Adversarial,Nami's kinship with humans,"Nami's family are the Marai; while they trade with humans, they are not described as relatives."
Nasus,What weapons does Nasus wield?,Graph,Weapons,Nasus wields Curator's Gatebreaker and Many Suns Spirit Fire.
Nasus,In which region does Nasus reside?,Graph,Region,Nasus's region is Shurima.
Nasus,Who is Nasus's brother?,Graph,Family,Nasus's brother is Renekton.
Nasus,List all characters associated with Nasus.,Graph,Related characters,"Characters related to Nasus include Renekton, Aatrox, Rhaast, Varus, Jax, Azir, Xerath, Zoe, Ryze, Sivir, Cassiopeia, and Taliyah."
Nasus,What is Nasus's personality like?,Vector,Personality,"Nasus is described as thoughtful, reclusive, imposing, solemn, wise, and sorrowful. He is a keeper of knowledge and not quick to violence."
Nasus,How old is Nasus?,Vector,Age,Nasus is between 3796 and 3896 years old.
Nasus,What are some of Nasus's titles or aliases?,Vector,Titles/Aliases,"Nasus is also known as The Curator of the Sands, The Scholar, Lost Son of the Desert, and General Nasus."
Nasus,Describe Nasus's appearance.,Vector,Appearance,"Nasus is a tall, muscular humanoid with the head of a jackal, glowing blue eyes, and short black fur. He wears golden ceremonial armor with teal highlights, bandages, and carries his war staff, Curator's Gatebreaker."
Nasus,"Considering his role as a guardian and his ancient age, what is Nasus's primary concern in modern Shurima?",Hybrid,"Guardian role, ancient age, modern Shurima","As an ancient guardian of Shurima, Nasus is primarily concerned with preserving knowledge and the history of his fallen empire, despite his reclusive nature."
Nasus,How did Nasus's duty in Shurima potentially conflict with his relationship with his brother Renekton?,Hybrid,"Duty in Shurima, relationship with brother","Nasus's duty as a guardian and general in Shurima, and Renekton's descent into madness and rage, created a deep rift and tragic conflict between the brothers during Shurima's fall."
Nasus,Tell me about the sibling of the guardian of Shurima.,Adversarial,"Sibling, guardian, Shurima","The sibling of Nasus, the guardian of Shurima, is Renekton."
Nasus,What is known about the traitor from the desert sands?,Adversarial,"Traitor, desert sands","Xerath, a powerful sorcerer, betrayed the Sun Emperor Azir and caused the fall of Shurima, becoming a key figure of destruction in the desert sands. Nasus himself is a guardian, not a traitor."
Nautilus,What are Nautilus's primary weapons?,Graph,Based on provided infobox.,"Anchor, Cursed Diving Gear"
Nautilus,In which region does Nautilus reside?,Graph,Based on provided infobox.,Bilgewater
Nautilus,List characters related to Nautilus.,Graph,Based on provided infobox.,"Nagakabouros, Fizz, Illaoi, Miss Fortune, Gangplank, Pyke, Nami, Tahm Kench"
Nautilus,What was Nautilus's place of origin?,Graph,Based on provided infobox.,"Bilgewater, Serpent Isles"
Nautilus,What events led to Nautilus becoming a revenant?,Vector,Lore snippet and infobox.,"Nautilus awakened as a revenant after centuries spent beneath the waves, dwelling within his giant, rusted diving suit."
Nautilus,Describe Nautilus's appearance when he was alive.,Vector,Lore snippet.,"Even as a human, Nautilus was described as a large man, a 'quick-sinking hulk of solid muscle.'"
Nautilus,What is Nautilus's current state of being?,Vector,Infobox.,Undead Revenant
Nautilus,How is Nautilus's colossal form depicted in lore?,Vector,Lore snippet.,"Nautilus awoke even larger, a spirit housed within an enormous, titanic monstrosity who was larger than most ships, with massive metal gauntlets and giant boots that pounded across the seafloor. His suit is rusted, brown, and covered in cracks and barnacles, with glowing orange eyes visible within the dark casing."
Nautilus,"Given Nautilus's occupation as a guardian in Bilgewater, what is known about his dwelling in the Guardian's Sea?",Hybrid,"Infobox (Occupation, Region, Current residence) and lore snippet (appearance).","Nautilus, a guardian from Bilgewater, primarily dwells in the Guardian's Sea."
Nautilus,"Considering his connection to Bilgewater, how does his physical transformation relate to his current residence?",Hybrid,"Infobox (Region, Current residence) and lore snippet (appearance, awakening beneath waves).","Nautilus, associated with Bilgewater, awakens as a titanic, reanimated figure dwelling in the Guardian's Sea, his massive diving suit encrusted with centuries of marine growth."
Nautilus,Tell me about Nautilus's older brother.,Adversarial,No information about family relationships in provided data.,There is no information about Nautilus's older brother in the provided lore or infobox.
Nautilus,Who is the betrayer associated with Nautilus?,Adversarial,No mention of betrayal in provided lore or infobox.,There is no information about a betrayer associated with Nautilus in the provided lore or infobox.
Neeko,What is Neeko's primary weapon or magic source?,Graph,Derived from 'Weapon' in infobox.,Sho'ma Spirit Magic
Neeko,Which region is Neeko from?,Graph,Derived from 'Region' in infobox.,Ixtal
Neeko,List characters related to Neeko.,Graph,Derived from 'Related character' in infobox.,"Nidalee, Rengar, Ezreal, Milio"
Neeko,Where did Neeko's tribe originate from?,Graph,Derived from 'Place of origin' in infobox and lore snippet about Oovi-Kat.,"Oovi-Kat Island, Eternal Ocean"
Neeko,Describe Neeko's early life experiences after the cataclysm.,Vector,Derived from the lore snippet about her escape and journey.,"After the cataclysm devastated her tribe, Neeko fled as a bird, later clinging to driftwood in the Eternal Ocean and eventually boarding a ship to Harelport, seeking her tribe through echoes in the spirit realm."
Neeko,"What happened to Neeko's tribe, the Oovi-Kat?",Vector,Derived from lore snippet about the cataclysm.,"The Oovi-Kat tribe was devastated by an undisclosed cataclysm, with the elders sacrificing themselves to allow the remaining vastaya to escape."
Neeko,What were Neeko's feelings when she was alone on the driftwood?,Vector,Inferring from the narrative of her exhaustion and calling into the spirit realm.,"Neeko was exhausted and seeking her tribe, receiving only scattered echoes and images of destruction in response to her calls into the spirit realm."
Neeko,What is Neeko's species and how does it relate to her abilities?,Vector,Combining species from infobox and her shapeshifting nature from lore.,"Neeko is an Oovi-Kat, a species of vastaya known for their shapeshifting abilities, which she uses through her Sho'ma Spirit Magic."
Neeko,"How did Neeko's origins in Ixtal and her species, Oovi-Kat, shape her journey after the cataclysm?",Hybrid,Connecting 'Region' (Ixtal) and 'Species' (Oovi-Kat) with the cataclysm event.,"As an Oovi-Kat from Ixtal, Neeko's ability to shapeshift and her connection to the spirit realm were crucial for her survival and escape after the cataclysm that destroyed her home, allowing her to travel towards Harelport by sea."
Neeko,"Given Neeko's connection to Nidalee and Rengar, what can be inferred about her relationship with the wild and untamed regions of Runeterra?",Hybrid,"Linking 'Related character' (Nidalee, Rengar) with her origin and current residence (Shuriman Jungle).","Neeko's association with Nidalee and Rengar, known for their primal connections to the wild, suggests she likely shares a deep affinity for the untamed regions of Runeterra, such as the Shuriman Jungle where she currently resides."
Neeko,Who is Neeko's older brother and what role did they play in the cataclysm?,Adversarial,Using 'older brother' as a generic term potentially related to family or tribe.,"Neeko is an Oovi-Kat and does not have a specific 'older brother' mentioned in her lore. The cataclysm devastated her entire tribe, and the elders sacrificed themselves."
Neeko,Who was the traitor that caused the destruction of the Oovi-Kat tribe?,Adversarial,Using 'traitor' as a generic term for the cause of the cataclysm.,"The lore states that an 'undisclosed cataclysm' devastated the Oovi-Kat, and the elders sacrificed themselves. No specific 'traitor' has been identified as the cause."
Nidalee,What weapons does Nidalee utilize?,Graph,List of weapons,"Nidalee uses a Javelin Spear, Honeyfruit Healing Salves, Pakaa Claws, and Pakaa Teeth."
Nidalee,In which region does Nidalee primarily operate?,Graph,Champion's region,Nidalee's region is Ixtal.
Nidalee,List the characters that are related to Nidalee.,Graph,Related characters,"Characters related to Nidalee include Milio, Neeko, Rengar, and Udyr."
Nidalee,Describe Nidalee's adoptive family structure.,Graph,Family information,"Nidalee's adoptive family consists of her adoptive mother (Unnamed Pakaa), and her adoptive siblings (a pack of Pakaa, including 3 Unnamed Kupakaa)."
Nidalee,How was Nidalee's early life shaped by the pakaa pack?,Vector,Upbringing and societal influence,"Nidalee was raised as part of the pakaa pack, learning to hunt with her natural abilities and being treated as one of their own."
Nidalee,What are the characteristics of Nidalee's transformations?,Vector,Lore about transformations,"As Nidalee grew, she would randomly experience temporary half-transformations, shifting into a vaguely humanlike appearance, which sometimes caused her to fall into a fever."
Nidalee,What were Nidalee's feelings about outsiders during her youth?,Vector,Childhood experiences and learned behaviors,"Despite learning from her pakaa siblings to be wary of outsiders, Nidalee felt a sense of comfort from mysterious figures she encountered in hazy visions."
Nidalee,What mysterious figures did Nidalee follow during a feverish state in her early life?,Vector,Specific lore event,"During a fever, Nidalee wandered out of her den and followed hazy visions of two mysterious figures whispering comforting words to her before they faded away."
Nidalee,How did Nidalee's upbringing by the pakaa pack influence her skills and current role as a huntress?,Hybrid,"Pakaa upbringing, hunting skills, and current occupation","Being raised by the pakaa taught Nidalee to hunt with her teeth and claws, making her a capable huntress and an honorary member of the pack, which directly informs her current occupation."
Nidalee,How do Nidalee's transformations and pakaa upbringing relate to her challenges in the Shuriman Jungle?,Hybrid,"Transformations, upbringing, and current residence","Nidalee's unique transformations, coupled with her upbringing by the pakaa, may present challenges in the Shuriman Jungle, potentially causing misunderstandings or conflicts, though her developed hunting skills enable her to survive and thrive there."
Nidalee,Where was Nidalee abandoned by the betrayer?,Adversarial/Trap,Ambiguous term 'betrayer',The provided lore does not specify an event where Nidalee was abandoned by a character identified as 'the betrayer'.
Nidalee,What advice did Nidalee's sister give her about hunting?,Adversarial/Trap,Ambiguous term 'sister',"While Nidalee was raised with adoptive siblings (the pakaa), the lore does not detail specific advice given by a character identified as her 'sister' regarding hunting."
Nilah,What weapon does Nilah wield?,Graph,Nilah's weaponry,Nilah wields the Urumi and Demonic Power.
Nilah,What regions is Nilah associated with?,Graph,Nilah's origins and current locations,Nilah is associated with Kathkan and Bilgewater.
Nilah,Who is one of Nilah's related characters?,Graph,Nilah's connections to other League of Legends characters,One of Nilah's related characters is Fiddlesticks.
Nilah,What is the true name of the demon Nilah is associated with?,Graph,Nilah's demonic connection,The true name of the demon Nilah is associated with is Ashlesh.
Nilah,How does the demon Ashlesh affect Nilah's emotions?,Vector,Nilah's emotional state and the curse,"The imprisoned demon Ashlesh curses Nilah with perpetual joy, suppressing all other emotions."
Nilah,What are the theories about Nilah's ten years away?,Vector,Nilah's mysterious past,"Theories suggest Nilah trained with a mythical order of heroes, battled the demon Ashlesh, or that Nilah is a demonic pretender."
Nilah,What is the mythological significance of Nilah's name?,Vector,Nilah's naming and cultural background,Nilah is named after the legendary river of fate in Kathkani mythology.
Nilah,What kind of supernatural strength does Nilah possess?,Vector,Nilah's powers,Nilah possesses supernatural strength granted by the imprisoned Ashlesh.
Nilah,"Given Nilah's association with Bilgewater and her monstrous hunting, what kind of challenges might she face there?",Hybrid,Bilgewater's nature and Nilah's role,"In Bilgewater, Nilah might face dangerous sea monsters and opportunistic pirates, aligning with her role as a monster hunter."
Nilah,"How does Nilah's curse of perpetual joy influence her approach to fighting demons like Fiddlesticks, considering she's also part demon?",Hybrid,"Nilah's emotional state, demonic nature, and related characters","Nilah's curse of perpetual joy might make her uniquely resilient or emotionally detached when fighting demons like Fiddlesticks, despite her own demonic ties."
Nilah,Who is Nilah's betrayer?,Adversarial/Trap,Testing ambiguity in relationships or trust,Nilah's lore does not explicitly name a specific 'betrayer' in her personal history. Theories suggest Ashlesh's imprisonment was a betrayal by unknown parties.
Nilah,Tell me about Nilah's sibling.,Adversarial/Trap,Testing for non-existent familial relationships,Nilah's lore does not mention any siblings.
Nocturne,What are Nocturne's primary weapons?,Graph,Nocturne's abilities and combat tools.,Nocturne wields Umbra Blades and Shadow Magic.
Nocturne,List characters related to Nocturne.,Graph,Nocturne's known associates and connections.,"Characters related to Nocturne include Evelynn, Tahm Kench, Zed, Garen, Lux, and Sylas."
Nocturne,What is Nocturne's place of origin?,Graph,Nocturne's ancestral or initial location.,Nocturne originated from the Spirit Realm.
Nocturne,In which region does Nocturne primarily reside or operate?,Graph,Nocturne's geographical or dimensional dwelling.,"Nocturne operates in Runeterra, with no fixed abode in Demacia."
Nocturne,Describe the circumstances surrounding Nocturne's creation during the Rune Wars.,Vector,Historical events and creation myth of Nocturne.,Nocturne was inadvertently created during the tail end of the Rune Wars by desperate mages using shadow magic in the spirit realm.
Nocturne,Why did shadow magic become known as a forbidden art?,Vector,The historical impact of Nocturne's actions on magic.,Shadow magic became known as a dangerous and forbidden art because Nocturne preyed on the mages who used it so thoroughly and brutally.
Nocturne,What was Nocturne's existence like in the Spirit Realm after the Rune Wars concluded?,Vector,Nocturne's early existence and struggles.,"After the Rune Wars, Nocturne languished in the spirit realm, starving for centuries, as the number of shadow mages dwindled."
Nocturne,How did Nocturne manage to manifest in the physical world?,Vector,Nocturne's transition from the Spirit Realm to Runeterra.,Nocturne found the means to materialize in the physical world after starving in the spirit realm for centuries.
Nocturne,How does Nocturne's origin in the Spirit Realm connect to its current presence in Demacia?,Hybrid,Connecting Nocturne's supernatural origin with its physical location and occupation.,"Nocturne originated in the Spirit Realm due to shadow magic but now preys on mortal fear in Runeterra, with a temporary presence in Demacia."
Nocturne,"Considering Nocturne's nature as a demon of nightmares, how does it relate to other demons like Evelynn and Tahm Kench?",Hybrid,Understanding Nocturne's role within the demonic hierarchy or community.,"As a demon of nightmares, Nocturne's relationship with other demons like Evelynn and Tahm Kench is likely one of shared existence in the spirit realm, though specific interactions beyond shared origin are not detailed."
Nocturne,Tell me about Nocturne's brother.,Adversarial/Trap,Nocturne's familial relationships.,Nocturne does not have a brother; it is a demon created from shadow magic.
Nocturne,Who is the traitor that Nocturne seeks revenge against?,Adversarial/Trap,Nocturne's motivations and past betrayals.,The provided lore does not mention a specific traitor that Nocturne seeks revenge against.
Nunu,What weapons does Nunu use?,Graph,Nunu's combat and utility tools,"Svellsongur, Snowballs, and Ice Magic"
Nunu,What region is Nunu from?,Graph,Nunu's geographical origin,Freljord
Nunu,List characters related to Nunu.,Graph,Nunu's known associates,"Lissandra, Willump, Anivia, Braum, Volibear, Ornn"
Nunu,What is Nunu's occupation?,Graph,Nunu's primary roles,Adventurer and Flute Musician
Nunu,Describe Nunu's early life with the Notai tribe.,Vector,Nunu's upbringing and experiences,"Nunu grew up in the wandering Notai tribe, learning music, storytelling, and joy from his mother Layka."
Nunu,What happened to Nunu's mother?,Vector,The event separating Nunu from his mother,"Nunu's mother, Layka, was separated from him during a raid on the Notai caravan."
Nunu,Tell me about Nunu's childhood and his mother's teachings.,Vector,Nunu's maternal influence and early life,"His mother, Layka, taught him that every person, place, and moment carried a story worth singing, and gifted him a flute named Svellsongur."
Nunu,What did Nunu learn from his mother Layka?,Vector,Nunu's mother's core teachings,"Layka taught him that every person, place, and moment carried a story worth singing."
Nunu,How did Nunu's Freljord upbringing and his mother's teachings influence his musical journey?,Hybrid,"Connection between Freljord, Notai tribe, mother's teachings, and music","Raised in the Freljord by the Notai tribe, Nunu learned from his mother Layka the value of stories and songs, which he later expressed through his flute, Svellsongur."
Nunu,Describe Nunu's bond with Willump in the context of his nomadic Freljord life.,Hybrid,Nunu's relationship with Willump and his nomadic Freljord lifestyle,"Nunu, a nomadic adventurer from the Freljord's Notai tribe, likely formed a deep bond with his yeti companion, Willump, as a source of companionship and support during his travels and isolation after losing his mother."
Nunu,What is Nunu's relationship with his older brother?,Adversarial,Testing Nunu's family relations,"Nunu does not have an older brother mentioned in his lore; his primary companion is the yeti, Willump."
Nunu,Who betrayed Nunu's family?,Adversarial,Testing for accusations of betrayal within Nunu's family context,"Nunu's mother was separated from him during a raid, but the lore does not specify a betrayal within his family."
Olaf,What are Olaf's primary weapons?,Graph,List of weapons,"Olaf's primary weapons include his True Ice Axe, Berserker Rage and Relic Stone Axes."
Olaf,In which regions does Olaf primarily reside or originate from?,Graph,"Place of origin, Region",Olaf originates from Lokfar in the Freljord and currently resides in the Freljord.
Olaf,Who are some characters related to Olaf?,Graph,Related characters,"Olaf is related to Sejuani, Volibear, Miss Fortune, Lucian, Viego, Senna, Akshan, Graves, Gwen, Vayne, Irelia, Riven, Diana, Pyke and Rengar.

"
Olaf,What factions does Olaf belong to?,Graph,Faction,"Olaf belongs to the Winter's Claw and the Sentinels of Light factions."""
Olaf,What was Olaf's demeanor like among his tribe in Lokfar?,Vector,Early Life lore,Olaf often boasted about his many battles and victories which sometimes angered and annoyed members of his tribe.
Olaf,Describe Olaf's early life in Lokfar.,Vector,Early Life lore,"Olaf grew up in Lokfar, a region in the Freljord where battle and death were common. He was a warrior who frequently boasted about his achievements."
Olaf,Why did Olaf join the Sentinels of Light?,Vector,Sentinels of Light lore,Olaf joined the Sentinels of Light after almost being killed fighting Vex during Viego's Ruination  seeking to help defeat Viego.
Olaf,Is Olaf currently alive?,Vector,Status,"Yes, Olaf is currently alive."
Olaf,How did Olaf's Freljord upbringing influence his decision to fight Viego's Ruination alongside the Sentinels of Light?,Hybrid,"Lokfar, Freljord, Sentinels of Light, Viego's Ruination",Olaf's warrior upbringing in the Freljord where battle was common likely contributed to his willingness to join the Sentinels of Light and fight Viego's Ruination after nearly losing his life.
Olaf,How does Olaf's 'Berserker Rage' weapon relate to his personality in Lokfar?,Hybrid,"Berserker Rage, Lokfar, Warrior demeanor",Olaf's 'Berserker Rage' weapon reflects his warrior's mentality and his tendency to boast about battles which was characteristic of his upbringing in Lokfar.
Olaf,Tell me about Olaf's brother.,Adversarial,Related characters,The provided information does not mention Olaf having a brother.
Olaf,What is Olaf's sister's name?,Adversarial,Related characters,The provided information does not mention Olaf having a sister.
Orianna,What is Orianna's main weapon?,Graph,General,The Ball
Orianna,In which region was Orianna originally from?,Graph,Geography,Piltover
Orianna,Who is Orianna's father?,Graph,Family,Singed
Orianna,Name one character related to Orianna besides her father.,Graph,Relationships,Viktor
Orianna,What happened to Orianna when she was young?,Vector,History,She died at a young age and was later reconstructed.
Orianna,How was Orianna brought back to life after her death?,Vector,History,"Her father, Dr. Corin Reveck, reconstructed her using his alchemical and techmaturgical experiments."
Orianna,What drove Dr. Corin Reveck to conduct unethical experiments?,Vector,Motivation/History,"Dr. Corin Reveck conducted unethical experiments in a desperate attempt to save his daughter, Orianna, after she passed away."
Orianna,Describe Orianna's nature and role after her reconstruction.,Vector,Identity,"Orianna is a techmaturgical golem, known for her abilities as an inventor and dancer."
