query,expected_context,ground_truth_answer
"How does Nilah's curse of perpetual joy influence her approach to fighting demons like Fiddlesticks, considering she's also part demon?","Nilah's emotional state, demonic nature, and related characters","Nilah's curse of perpetual joy might make her uniquely resilient or emotionally detached when fighting demons like Fiddlesticks, despite her own demonic ties."
Who is Nilah's betrayer?,Testing ambiguity in relationships or trust,Nilah's lore does not explicitly name a specific 'betrayer' in her personal history. Theories suggest Ashlesh's imprisonment was a betrayal by unknown parties.
Tell me about Nilah's sibling.,Testing for non-existent familial relationships,Nilah's lore does not mention any siblings.
What are Nocturne's primary weapons?,Nocturne's abilities and combat tools.,Nocturne wields Umbra Blades and Shadow Magic.
List characters related to Nocturne.,Nocturne's known associates and connections.,"Characters related to Nocturne include Evelynn, Tahm Kench, Zed, Garen, Lux, and Sylas."
What is Nocturne's place of origin?,Nocturne's ancestral or initial location.,Nocturne originated from the Spirit Realm.
In which region does Nocturne primarily reside or operate?,Nocturne's geographical or dimensional dwelling.,"Nocturne operates in Runeterra, with no fixed abode in Demacia."
Describe the circumstances surrounding Nocturne's creation during the Rune Wars.,Historical events and creation myth of Nocturne.,Nocturne was inadvertently created during the tail end of the Rune Wars by desperate mages using shadow magic in the spirit realm.
Why did shadow magic become known as a forbidden art?,The historical impact of Nocturne's actions on magic.,Shadow magic became known as a dangerous and forbidden art because Nocturne preyed on the mages who used it so thoroughly and brutally.
What was Nocturne's existence like in the Spirit Realm after the Rune Wars concluded?,Nocturne's early existence and struggles.,"After the Rune Wars, Nocturne languished in the spirit realm, starving for centuries, as the number of shadow mages dwindled."
How did Nocturne manage to manifest in the physical world?,Nocturne's transition from the Spirit Realm to Runeterra.,Nocturne found the means to materialize in the physical world after starving in the spirit realm for centuries.
How does Nocturne's origin in the Spirit Realm connect to its current presence in Demacia?,Connecting Nocturne's supernatural origin with its physical location and occupation.,"Nocturne originated in the Spirit Realm due to shadow magic but now preys on mortal fear in Runeterra, with a temporary presence in Demacia."
"Considering Nocturne's nature as a demon of nightmares, how does it relate to other demons like Evelynn and Tahm Kench?",Understanding Nocturne's role within the demonic hierarchy or community.,"As a demon of nightmares, Nocturne's relationship with other demons like Evelynn and Tahm Kench is likely one of shared existence in the spirit realm, though specific interactions beyond shared origin are not detailed."
Tell me about Nocturne's brother.,Nocturne's familial relationships.,Nocturne does not have a brother; it is a demon created from shadow magic.
Who is the traitor that Nocturne seeks revenge against?,Nocturne's motivations and past betrayals.,The provided lore does not mention a specific traitor that Nocturne seeks revenge against.
What weapons does Nunu use?,Nunu's combat and utility tools,"Svellsongur, Snowballs, and Ice Magic"
What region is Nunu from?,Nunu's geographical origin,Freljord
List characters related to Nunu.,Nunu's known associates,"Lissandra, Willump, Anivia, Braum, Volibear, Ornn"
What is Nunu's occupation?,Nunu's primary roles,Adventurer and Flute Musician
Describe Nunu's early life with the Notai tribe.,Nunu's upbringing and experiences,"Nunu grew up in the wandering Notai tribe, learning music, storytelling, and joy from his mother Layka."
What happened to Nunu's mother?,The event separating Nunu from his mother,"Nunu's mother, Layka, was separated from him during a raid on the Notai caravan."
Tell me about Nunu's childhood and his mother's teachings.,Nunu's maternal influence and early life,"His mother, Layka, taught him that every person, place, and moment carried a story worth singing, and gifted him a flute named Svellsongur."
What did Nunu learn from his mother Layka?,Nunu's mother's core teachings,"Layka taught him that every person, place, and moment carried a story worth singing."
How did Nunu's Freljord upbringing and his mother's teachings influence his musical journey?,"Connection between Freljord, Notai tribe, mother's teachings, and music","Raised in the Freljord by the Notai tribe, Nunu learned from his mother Layka the value of stories and songs, which he later expressed through his flute, Svellsongur."
Describe Nunu's bond with Willump in the context of his nomadic Freljord life.,Nunu's relationship with Willump and his nomadic Freljord lifestyle,"Nunu, a nomadic adventurer from the Freljord's Notai tribe, likely formed a deep bond with his yeti companion, Willump, as a source of companionship and support during his travels and isolation after losing his mother."
What is Nunu's relationship with his older brother?,Testing Nunu's family relations,"Nunu does not have an older brother mentioned in his lore; his primary companion is the yeti, Willump."
Who betrayed Nunu's family?,Testing for accusations of betrayal within Nunu's family context,"Nunu's mother was separated from him during a raid, but the lore does not specify a betrayal within his family."
What are Olaf's primary weapons?,List of weapons,"Olaf's primary weapons include his True Ice Axe, Berserker Rage and Relic Stone Axes."
In which regions does Olaf primarily reside or originate from?,"Place of origin, Region",Olaf originates from Lokfar in the Freljord and currently resides in the Freljord.
Who are some characters related to Olaf?,Related characters,"Olaf is related to Sejuani, Volibear, Miss Fortune, Lucian, Viego, Senna, Akshan, Graves, Gwen, Vayne, Irelia, Riven, Diana, Pyke and Rengar.

"
What factions does Olaf belong to?,Faction,"Olaf belongs to the Winter's Claw and the Sentinels of Light factions."""
What was Olaf's demeanor like among his tribe in Lokfar?,Early Life lore,Olaf often boasted about his many battles and victories which sometimes angered and annoyed members of his tribe.
Describe Olaf's early life in Lokfar.,Early Life lore,"Olaf grew up in Lokfar, a region in the Freljord where battle and death were common. He was a warrior who frequently boasted about his achievements."
Why did Olaf join the Sentinels of Light?,Sentinels of Light lore,Olaf joined the Sentinels of Light after almost being killed fighting Vex during Viego's Ruination  seeking to help defeat Viego.
Is Olaf currently alive?,Status,"Yes, Olaf is currently alive."
How did Olaf's Freljord upbringing influence his decision to fight Viego's Ruination alongside the Sentinels of Light?,"Lokfar, Freljord, Sentinels of Light, Viego's Ruination",Olaf's warrior upbringing in the Freljord where battle was common likely contributed to his willingness to join the Sentinels of Light and fight Viego's Ruination after nearly losing his life.
How does Olaf's 'Berserker Rage' weapon relate to his personality in Lokfar?,"Berserker Rage, Lokfar, Warrior demeanor",Olaf's 'Berserker Rage' weapon reflects his warrior's mentality and his tendency to boast about battles which was characteristic of his upbringing in Lokfar.
Tell me about Olaf's brother.,Related characters,The provided information does not mention Olaf having a brother.
What is Olaf's sister's name?,Related characters,The provided information does not mention Olaf having a sister.
What is Orianna's main weapon?,General,The Ball
In which region was Orianna originally from?,Geography,Piltover
Who is Orianna's father?,Family,Singed
Name one character related to Orianna besides her father.,Relationships,Viktor
What happened to Orianna when she was young?,History,She died at a young age and was later reconstructed.
How was Orianna brought back to life after her death?,History,"Her father, Dr. Corin Reveck, reconstructed her using his alchemical and techmaturgical experiments."
What drove Dr. Corin Reveck to conduct unethical experiments?,Motivation/History,"Dr. Corin Reveck conducted unethical experiments in a desperate attempt to save his daughter, Orianna, after she passed away."
Describe Orianna's nature and role after her reconstruction.,Identity,"Orianna is a techmaturgical golem, known for her abilities as an inventor and dancer."
Why did Orianna's father move to Zaun after his experiments in Piltover?,Piltover/Zaun geography and alchemical history,"He moved to Zaun after his unethical experiments to save Orianna were discovered, leading to his dismissal from Piltover."
How did Orianna's reconstruction impact her father's standing in Piltover and their subsequent move?,Family relationships and scientific ethics,Her father's unethical experiments to reconstruct her led to his dismissal from Piltover Academy and their subsequent move to Zaun.
What did Orianna's older brother do to her?,Family relationships,Orianna does not have an older brother mentioned in her lore.
In which region was Orianna originally from?,Geography,Piltover
Who is Orianna's father?,Family,Singed
Name one character related to Orianna besides her father.,Relationships,Viktor
What happened to Orianna when she was young?,History,She died at a young age and was later reconstructed.
How was Orianna brought back to life after her death?,History,"Her father, Dr. Corin Reveck, reconstructed her using his alchemical and techmaturgical experiments."
What drove Dr. Corin Reveck to conduct unethical experiments?,Motivation/History,"Dr. Corin Reveck conducted unethical experiments in a desperate attempt to save his daughter, Orianna, after she passed away."
Describe Orianna's nature and role after her reconstruction.,Identity,"Orianna is a techmaturgical golem, known for her abilities as an inventor and dancer."
Why did Orianna's father move to Zaun after his experiments in Piltover?,Piltover/Zaun geography and alchemical history,"He moved to Zaun after his unethical experiments to save Orianna were discovered, leading to his dismissal from Piltover."
How did Orianna's reconstruction impact her father's standing in Piltover and their subsequent move?,Family relationships and scientific ethics,Her father's unethical experiments to reconstruct her led to his dismissal from Piltover Academy and their subsequent move to Zaun.
What did Orianna's older brother do to her?,Family relationships,Orianna does not have an older brother mentioned in her lore.
Who was the traitor that caused Orianna's father to be dismissed?,Ethics and Piltover politics,There is no mention of a specific 'traitor' causing Dr. Reveck's dismissal; his dismissal was a consequence of his unethical experiments being discovered.
List all weapons Ornn is known to wield.,List weapons,"The Hammer, Primordial Flame, The Spade, The Fork, The Ram-Door."
Who are Ornn's siblings?,List family members,"Ornn's siblings include Volibear, Anivia, Ildhaurg, and several unnamed siblings (Wildclaw, Raven, Seal Sister, Lynx, Owl)."
In which region does Ornn primarily reside?,Region of residence,Ornn primarily resides in the Freljord.
Name one character related to Ornn.,Related characters,One character related to Ornn is Volibear.
Describe Ornn's personality based on his lore.,Personality/Psychology,Ornn is often described as grumpy and a dedicated craftsman who respects the land.
What event led to Ornn gaining the power of the primordial flame?,Lore/History of power,"Ornn gained the power of the primordial flame after fighting and reshaping the land of Freljord, and in return, the land opened itself to him."
How did Ornn shape the landscape of the Freljord in his youth?,Historical actions,Ornn shaped the Freljord by headbutting mountains and beating valleys into shape during a fight with the land.
What was Ornn's motivation for dedicating himself to forging tools and weapons?,Motivation/History,"After gaining the power of the primordial flame and reshaping the land, Ornn dedicated himself to forging tools and weapons."
How did Ornn's act of reshaping the Freljord contribute to his role as a smith?,Connection between shaping land and forging,"After fighting and reshaping the Freljord, Ornn gained the power of the primordial flame, which he then dedicated himself to using for forging tools and weapons."
"Describe the relationship between Ornn and his brother Volibear, considering their shared origin in the Freljord.",Sibling relationship and Freljord origin,Ornn and Volibear are brothers who originated from the Freljord. Their shared origin likely influences their roles as powerful spirits within the region.
Who is the betrayer associated with Ornn's brother?,Test for entity resolution of 'betrayer' in relation to Volibear.,"The provided lore does not specify any betrayer associated with Ornn's brother, Volibear."
Tell me about the youngest sister of Ornn.,Test for entity resolution of 'youngest sister'.,"Ornn has sisters like Anivia and Aurora, but the lore does not specify who is the youngest."
What weapons does Pantheon wield?,List weapons,"Pantheon wields Celestial Magic, Skyfall of Areion, Aegis of Zeonia, Solstice of Astraea, and Nova of Atreus."
In which regions is Pantheon primarily active?,List regions,"Pantheon is associated with Targon, including Targon Prime and Rakkor Caves on Mount Targon."
Who are some of Pantheon's key related characters?,List related characters,"Key related characters to Pantheon include The Warrior, Aatrox, Leona, Diana, Aurelion Sol, Taric, Zoe, Soraka, Graves, Lucian, and Vayne."
Describe the bond between Atreus and Pylas.,Specific relationship,Atreus and Pylas forged a strong bond of brotherhood through their grueling training sessions as Ra'Horak warriors.
Tell me about Atreus's early life and training on Mount Targon.,History,"Atreus was born on Mount Targon among the Rakkor tribes and rigorously trained as a Ra'Horak warrior, known for his endurance and spirit despite a lack of innate talent."
What defining qualities does Atreus possess in his fighting spirit?,Psychology,"Atreus possesses impressive endurance and a relentless fighting spirit, always standing back up despite injuries."
What was Atreus's role and experience as a Ra'Horak warrior?,Past events,"As a Ra'Horak warrior, Atreus underwent brutal training regimens and bouts, pushing his limits through sheer persistence and spirit."
What is the lore significance of the 'Aspect of War' for Pantheon?,Lore,"The Aspect of War is a divine power that Pantheon embodies, granting him his formidable combat abilities and warrior status."
How did Atreus's endurance on Targon influence his destiny?,Region and Lore,"Atreus's relentless endurance and fighting spirit, honed through his early life and training on Targon, ultimately allowed him to endure the trials to become the Aspect of War."
What significance does the Aegis of Zeonia hold within Pantheon's arsenal and lore?,Weapon and Lore,"The Aegis of Zeonia is one of Pantheon's weapons, representing a powerful artifact associated with his Aspect of War powers and combat prowess."
Tell me about Atreus's best friend and his brother.,Ambiguous term resolution,"Atreus's best friend was Pylas, with whom he forged a strong bond of brotherhood. The term 'brother' in this context refers to their deep camaraderie rather than a literal sibling relationship."
Who is the traitor that Atreus fought?,Ambiguous term resolution,There is no specific 'traitor' mentioned in relation to Atreus's early life or ascension in the provided lore. His primary conflict was with the demands of training and the Aspect's trials.
What is the name of Poppy's primary weapon?,Champion Attributes,Hammer of Orlon
In which region is Poppy known to be a hero?,Champion Attributes,Demacia
Who are some characters that share a connection with Poppy?,Related Characters,"Lulu, Tristana, Galio, Shyvana, Vayne"
What is Poppy's role or occupation?,Champion Attributes,"Hero Seeker, Warrior"
Describe Poppy's feelings about other Yordles in Bandle City.,Lore Snippet,Poppy felt disconnected from the chaotic and whimsical nature of other Yordles.
What motivated Poppy to leave Bandle City and travel to human lands?,Lore Snippet,Poppy was driven by an unshakeable desire to find her own purpose and a longing for order.
What specific quality did Poppy admire in the human settlers she encountered?,Lore Snippet,Poppy admired their determination and the way they worked together to create something greater than themselves.
What aspect of Poppy's personality was alien to her compared to other Yordles?,Lore Snippet,The chaotic and whimsical nature of the typical Yordle lifestyle was alien to her.
How does Poppy's Yordle nature and search for purpose manifest in her role as Hero of Demacia?,Lore & Region,"Poppy's longing for order and her disciplined pursuit of purpose drive her to seek out and support those who embody heroism in Demacia, often by wielding the Hammer of Orlon."
"Considering her background, what kind of beings would Poppy seek out in Demacia for their sense of purpose?",Lore & Region,"Poppy would seek out individuals or groups in Demacia who demonstrate discipline, order, and a strong sense of purpose, much like the settlers she admired."
Does Poppy have an older brother who betrayed her?,Entity Resolution,There is no information about Poppy having an older brother or a betrayal.
"Who is Poppy's most trusted female companion in Demacia, excluding Lulu?",Entity Resolution,"The provided information does not specify Poppy's most trusted female companion in Demacia besides Lulu, nor does it detail specific relationships beyond general connections."
What is Qiyana's signature weapon?,Weapon,"Qiyana wields the Ohmlatl, a weapon infused with elemental magic."
In which region does Qiyana hail from?,Region,"Qiyana hails from Ixtal, specifically the region of Ixaocan."
List the names of Qiyana's known sisters.,Family/Sisters,Qiyana's known sisters are Inessa Yunalai and Mara Yunalai.
What is the name of Qiyana's ancestral home?,Place of Origin,Qiyana's ancestral home is Ixaocan.
Describe Qiyana's early feelings about her place in the royal succession.,Psychology/Early Life,Qiyana grew up believing the throne would never be hers due to being the last of nine sisters.
What kind of elemental magic did Qiyana train in?,Skills/Abilities,"Qiyana was educated in the elemental magical arts of Ixtal, focusing on water, magma, and nature."
What event led Qiyana to believe she should claim the throne?,Ambition/Motivation,Seeing her potential and early mastery of powerful elemental magic techniques led Qiyana to believe the throne should be hers.
What historical event is mentioned in relation to Qiyana's lore that involved Piltovan miners?,Past Events,The lore mentions the 'Massacre of the Piltovan miners' as a contemporary historical event.
How did Qiyana's upbringing in Ixaocan contribute to her ambition for power within Ixtal?,Region + Ambition,"Growing up in Ixaocan as the last of nine sisters and demonstrating exceptional mastery of Ixtal's elemental magic fueled Qiyana's belief that she, rather than her siblings, deserved the throne."
Explain the connection between Qiyana's elemental magic training and her claim to the Yun Tal throne in Ixtal.,Abilities + Ambition + Region,"Qiyana's advanced and early mastery of elemental magic in Ixtal demonstrated her unique potential, leading her to believe she was the rightful heir to the Yun Tal throne, despite her position as the last of nine sisters."
Who is Qiyana's closest male relative?,Family/Misdirection,"Qiyana's closest known relatives are her sisters, Inessa Yunalai and Mara Yunalai, and seven unnamed sisters. No male relatives are mentioned."
Tell me about the betrayal Qiyana orchestrated against her rivals.,Lore/Misdirection,The provided lore does not mention Qiyana orchestrating any betrayal. It details her ambition driven by her magical prowess and her position within her family.
What weapon does Quinn use in combat?,Weapons,Quinn uses a Tuskvore Crossbow.
Who is Quinn's twin brother?,Family,Quinn's twin brother was named Caleb.
What region is Quinn from?,Place of origin,"Quinn is from Uwendale, Demacia."
What faction is Quinn associated with?,Faction,Quinn is associated with House Buvelle and the Demacian Rangers.
What were Quinn and Caleb's early interests after seeing knights?,Psychology,Quinn and her twin brother Caleb were impressed by knights and began to imitate them.
Describe the circumstances leading to Caleb's death.,History,Caleb died during a hunt when a wounded Tuskvore beast turned on the nobles and the rangers accompanying them.
What skills did Quinn develop from ranging in the wilds?,Past events,"From ranging in the wilds, Quinn became proficient in tracking and hunting prey."
What was Quinn's father's profession?,Background,Quinn's father was a weaponsmith.
"How did Quinn's upbringing in Uwendale, influenced by both her father's trade and mother's background, shape her ranger skills?",Region and Occupation,"Born in Uwendale to a weaponsmith and a ranger, Quinn and her brother Caleb took after their mother, becoming formidable rangers skilled in tracking and hunting, with Quinn wielding a bow."
"Considering Quinn's twin brother Caleb died during a hunt, what specific role did the wounded Tuskvore play in the incident?",History and Creature,The wounded Tuskvore beast was the direct cause of Caleb's death when it turned on the hunting party after being wounded.
What did the traitor say to Quinn?,Deception,There was no traitor; a wounded Tuskvore beast attacked the hunting party.
Tell me about the betrayal by Quinn's brother.,Betrayal,"Quinn's brother, Caleb, did not betray anyone; he died protecting the hunting party from a Tuskvore."
What weapon does Rammus use?,Rammus's equipment,Spiked Shell
In which region does Rammus primarily roam?,Rammus's current location,Shurima
Who is Rammus related to?,Rammus's known connections,Nyam
What is Rammus's species or place of origin?,Rammus's background and ancestry,Unknown (Possibly Baccai); Unknown (Possibly Shurima; Ancient Times)
What is Rammus's history before the Rune Wars?,Rammus's ancient past in Shurima,"His earliest depictions are from the Shuriman Age of Ascension, where he was seen among demigods and revered spirits."
How was Rammus perceived in ancient Shurima?,Rammus's historical perception by scholars,Scholars speculated he may have been seen as a harbinger of change or a guardian spirit of Shurima's shifting fate.
How did Rammus survive the Rune Wars?,Rammus's survival during the Rune Wars,"Stories say Rammus remained the same, rolling undisturbed through a dying world."
Describe a specific event where Rammus intervened.,Notable historical interventions by Rammus,"In one story, he entered the fortress of Siram—a labyrinth of magic and monsters—and within the hour, the entire structure collapsed into dust, with Rammus seen calmly rolling away."
"Considering Rammus's ancient Shuriman origins as a guardian spirit, why might he have intervened in the Siram fortress incident?",Rammus's role as a guardian spirit and his intervention in the Siram fortress,"As a guardian spirit, Rammus might have intervened in the Siram fortress incident because it was a labyrinth of magic and monsters, and his role was to address such threats or shifting fates."
"What happened to the fortress in Siram, and how does this event relate to Rammus's current nomadic lifestyle in Shurima?",The Siram fortress incident and Rammus's current residence,"The Siram fortress collapsed into dust shortly after Rammus entered it. This intervention is part of his history of unexplained events, contributing to his timeless nature and his current nomadic roaming in Shurima."
"Given Rammus was depicted among ancient Shuriman demigods, could he have been a traitor?",Rammus's connection to ancient Shuriman figures,"The provided lore does not state that Rammus was a traitor. He was depicted among demigods and revered spirits, often as a guardian spirit."
Does Rammus have any known siblings?,Rammus's family relationships,The provided lore does not mention Rammus having any siblings.
What weapons does Rek'Sai use?,Information about Rek'Sai's offensive capabilities and physical attributes.,"Rek'Sai uses her claws, fangs, and tail as weapons."
Who created Rek'Sai?,Details regarding the origin and creators of Rek'Sai.,Rek'Sai was created by the Watchers.
What region is Rek'Sai's primary domain?,Rek'Sai's geographical and dimensional affiliations.,"Rek'Sai's primary domain is the Void, though she also resides in Shurima."
List characters that are related to Rek'Sai.,Connections between Rek'Sai and other characters in Runeterra.,"Characters related to Rek'Sai include Skarner, Yuumi, Kai'Sa, and Taliyah."
Describe Rek'Sai's primal instincts and motivations.,Psychological and instinctual drives of Rek'Sai.,Rek'Sai is driven by a strong motherly instinct and the urge to hunt and claim territory as the Xer'Sai queen.
What was Rek'Sai's early life like in the Void?,Historical background of Rek'Sai's emergence and life in the Void.,"Rek'Sai originated in the Void as the queen of the Xer'Sai, a brood that made a home in Runeterra's sands after entering through a portal."
How did Rek'Sai's arrival impact Shurima?,Historical consequences and effects of Rek'Sai's presence in the Shuriman region.,"Rek'Sai and her brood devoured thousands of people in the Shuriman desert, causing the inhabitants to fear her as a bringer of death."
