query,expected_context,ground_truth_answer
How did Isolde's illness and death influence Gwen's fate?,Creator/History,"Isolde's death, caused by an assassin's blade, prompted Viego to take her corpse to the Blessed Isles, unleashing ruination and leading to Camavor's crumble, ultimately causing Gwen to be forgotten for centuries."
Does Gwen have any siblings?,Family/Lore,"Based on the provided information, Gwen does not have siblings; she was crafted as a doll by Isolde."
What is the significance of the 'betrayer' in Gwen's story?,Lore/Betrayal,"The provided lore does not explicitly mention a 'betrayer' directly in relation to Gwen's story. Isolde's death implies betrayal in Camavor's history, which indirectly impacted Gwen."
What weapons does Hecarim wield?,Weapons,Hecarim wields a Glaive and The Black Spear.
Which regions are associated with Hecarim?,Regions,Hecarim is associated with the Shadow Isles and the Kingdom of Camavor.
Who was Hecarim's former fiancée?,Family,Hecarim's former fiancée was Kalista.
List the characters related to Hecarim.,Related Characters,"Characters related to Hecarim include Viego, Kalista, Necrit, Isolde, Yorick, Thresh, Miss Fortune, Lucian, Illaoi, and Ledros."
Describe Hecarim's personality and motivations.,Psychology/Motivations,Hecarim is characterized by his darkness and lust for personal glory.
What was Hecarim's former role in the Kingdom of Camavor?,History,"In life, Hecarim was a lieutenant of the Iron Order, tasked with protecting the lands owned by King Viego of Camavor."
How did Hecarim become the leader of the Iron Order?,Past Events,"After Hecarim abandoned his commander to die in battle, the Iron Order swore allegiance to him."
What is Hecarim's current form or state?,Status,Hecarim is currently an Undead Wraith.
How did Hecarim's ambition in Camavor lead to his current existence in the Shadow Isles?,Region & History,Hecarim's ambition and betrayal in Camavor led to his death and subsequent existence as an undead wraith in the Shadow Isles.
Explain the connection between Hecarim's loyalty to King Viego in Camavor and his current allegiance in the Shadow Isles.,Relationship & Region,"While Hecarim served King Viego loyally in Camavor, his darker ambitions and betrayal led him to become a corrupted figure on the Shadow Isles."
Who did Hecarim betray to gain control of the Iron Order?,Entity Resolution/Betrayal,Hecarim betrayed his commander by choosing to leave him surrounded by enemies during a battle.
"What is the relationship between Hecarim and his brother, the Commander of the Iron Order?",Entity Resolution/Family,"Hecarim was a lieutenant under the Commander of the Iron Order, who was not his brother. Hecarim later abandoned this commander to die."
What weapons does Heimerdinger use?,List weapons,"Heimerdinger uses a Wrench, D.I.N.G.R., H-28G Evolution Turret, and Z-Drive."
What regions is Heimerdinger associated with?,List regions,Heimerdinger is associated with Piltover and Bandle City.
Who are some characters related to Heimerdinger?,List related characters,"Characters related to Heimerdinger include Stanwick, Singed, Orianna, Jayce, Viktor, Mel, Bolbok, Cassandra, Hoskel, Salo, Shoola, Grayson, Ekko, and Jinx."
What faction does Heimerdinger belong to?,List faction,Heimerdinger belongs to the Council of Piltover.
What drives Heimerdinger's passion for invention?,Heimerdinger's motivations and inventions,Heimerdinger's passion for invention is driven by a desire to help the people of Piltover and advance scientific understanding.
What role did Heimerdinger play in the founding of Piltover?,Early life and founding of Piltover,Heimerdinger helped found the city of Piltover as a refuge from magical forces after witnessing a catastrophic event.
How old was Heimerdinger during Arcane Act 1?,Age and timeline,Heimerdinger was 1307 years old during Arcane Act 1.
What is Heimerdinger's current known status?,Current status,"Heimerdinger's current status is unknown, as he was disintegrated into the Anomaly."
How did Heimerdinger's inventions impact Piltover's development as a city of progress?,"Piltover's founding, Heimerdinger's inventions, and his role as Dean/Councilor","Heimerdinger's unconventional devices and his role as dean and councilor significantly contributed to Piltover's reputation as a city of progress and innovation, helping its citizens and advancing scientific understanding."
How did Heimerdinger's experience witnessing a magical catastrophe influence his decision to help found Piltover?,"Witnessing magical catastrophe, founding Piltover","Witnessing a devastating magical catastrophe firsthand directly inspired Heimerdinger to help establish Piltover as a safe haven, seeking to prevent future such disasters through scientific and civic planning."
Did Heimerdinger betray his Yordle brethren by leaving Bandle City?,"Yordle origin, founding Piltover","Heimerdinger did not betray his Yordle brethren. He ventured from Bandle City and helped found Piltover as a refuge from magical forces, not out of malice towards his origin."
What are the general duties of a leader like Heimerdinger in Piltover?,Heimerdinger's roles as Dean and Council Head,"As Dean of Piltover Academy and Head of the Piltover Council, Heimerdinger's duties involved fostering innovation, mentoring students, and guiding the city's governance through scientific advancement and inventions."
What is Hwei's primary weapon?,Weapon,"Artistic magic, Paintbrush"
Where is Hwei originally from?,Place of origin,"Koyehn, Ionia"
Which characters are related to Hwei?,Related character,"Jhin, Shen, Zed"
What is Hwei's occupation?,Occupation,"Painter, Mage, Heir to the Temple of Koyehn"
How does Hwei's paint magic influence its audience?,Psychology,It influences the emotions of its audience.
What was Hwei's childhood like in Koyehn?,History,"Hwei spent his childhood immersed in vibrant surroundings, translating his wild daydreams onto canvas."
What is required to prevent Hwei's art from overpowering mental perceptions?,Lore detail,Strict control and discipline are necessary.
What is the significance of Hwei's shifting eye colors?,Lore detail,His shifting eye colors mirror the ebb and flow of his mind and mood.
How does Hwei's artistic magic connect to his origins in Ionia?,Region and Lore,"Hwei's artistic magic, paint magic, is an art form from the Temple of Koyehn in Ionia, influencing emotions through visual interpretation."
Describe the relationship between Hwei and Jhin in the context of Ionian art.,Relationships and Lore,"Jhin is listed as a related character to Hwei, but the provided lore snippet does not detail their specific relationship within Ionian art."
What is the name of Hwei's brother?,Entity resolution,The provided information does not mention Hwei having a brother.
Who is the traitor in Hwei's family?,Entity resolution,The provided information does not mention any traitor in Hwei's family.
What are Illaoi's primary weapons?,List of weapons,Illaoi wields the Eye of God and Nagakabouros.
What region is Illaoi from?,Origin region,Illaoi is from the Buhru tribe of the Serpent Isles.
Who was Illaoi's former lover?,Relationship history,Illaoi's former lover was Gangplank.
What is Illaoi's faction?,Faction affiliation,Illaoi belongs to the Buhru faction.
What is Illaoi's role as a spiritual leader?,Spiritual duties and beliefs,"Illaoi is the Truth Bearer of Nagakabouros, dedicated to spreading its faith and protecting the Serpent Islands."
How did Illaoi's upbringing influence her destiny?,Early life and spiritual training,"Illaoi was born into the Buhru tribe, showed high spiritual talent at a young age, and was trained into the priesthood, which prepared her for her role as the Truth Bearer."
Describe Illaoi's feelings about her past romance with Gangplank.,Personal history and relationships,"Illaoi was in love with Gangplank but was forced to end the relationship after being chosen as the Truth Bearer of Nagakabouros, dedicating herself entirely to her faith afterwards."
What are Illaoi's core beliefs and responsibilities?,Philosophy and duties,"Illaoi believes in and spreads the faith of Nagakabouros, and her primary responsibility is protecting the Serpent Islands."
How does Illaoi's devotion to Nagakabouros affect her connection to the Serpent Isles?,Role as Truth Bearer and protector of the Serpent Isles,"As the Truth Bearer of Nagakabouros, Illaoi is deeply devoted to spreading its faith and ensuring the protection of the Serpent Isles, making her a central figure in its spiritual and physical defense."
"Considering Illaoi's former relationship with Gangplank and her current residence in Bilgewater, how might her past influence her present actions?",Past relationship with Gangplank and current Bilgewater residence,"Illaoi's past romance with Gangplank and subsequent dedication to Nagakabouros could create complex dynamics in Bilgewater, especially given Gangplank's influence and her role as a protector of the Buhru people."
Tell me about Illaoi's mother.,Family relationships,There is no mention of Illaoi's mother in the provided lore.
What is Illaoi's brother's name and role in her life?,Family relationships,The provided information does not mention Illaoi having a brother.
What are Irelia's primary weapons?,Listing combat tools,"Xan Crest Blades, Blade Silk Dance, Relic Stone Blades"
What is Irelia's region of origin?,Ionian homeland,Ionia
Who were Irelia's brothers?,Family relationships,"Xan Zelos, Xan Kye, Xan Ohn, Xan Ruu"
Who was Irelia's grandmother?,Family relationships,O-ma
Why did Irelia pursue traditional dance from a young age?,Psychological motivation for dance,She was captivated by the grace and beauty of human movement.
What happened to Irelia's father and brothers during the Noxian invasion?,Historical event detail,Admiral Duqual of Noxus executed her father and brothers for resisting.
What role did Irelia's grandmother play in her life?,Early life influences,Her grandmother taught her the traditional silk dance of her province.
What command did Admiral Duqual give regarding Irelia's family crest?,Historical event detail,Duqual ordered his men to shatter the crest.
How did the Noxian invasion of Ionia shape Irelia's connection to dance and her identity?,Regional conflict and personal development,"The invasion's tragedy, including her family's execution, spurred her to find strength and a sense of rhythm in the traditional dance, using its movements to defend herself."
Describe the influence of Irelia's Ionian heritage on her role as a Sentinel of Light.,Cultural background and heroic duty,"Her Ionian upbringing, marked by traditional dance and deep connection to her home, instilled in her the grace, resilience, and resolve required to protect Runeterra as a Sentinel of Light."
Tell me about the traitor who wronged Irelia's family.,Ambiguous term 'traitor',"Admiral Duqual of Noxus, who seized her family's home and executed her father and brothers, acted as an antagonist to her family and people."
What did Irelia's brother do during the Noxian invasion?,Ambiguous 'brother' and actions,"Irelia's brothers, Xan Zelos, Xan Kye, Xan Ohn, and Xan Ruu, resisted the Noxian occupation and were executed for their defiance."
What regions are associated with Ivern's origins?,List places of origin,Freljord and Ionia are associated with Ivern's origins.
Who are Ivern's offspring?,List family members,Ivern's offspring are The Dreaming Tree and Lillia.
Who are characters directly related to Ivern besides Daisy?,List related characters,Lissandra and Lillia are characters directly related to Ivern besides Daisy.
What kind of magic does Ivern wield?,List weapons or abilities,Ivern wields Nature Magic.
Why did Ivern the Cruel seek out the land where magic flows?,Summarize historical motivations,Ivern the Cruel sought out the land where magic flows to harvest its power for himself.
Describe Ivern's actions upon reaching Ionia.,Summarize historical events,"Upon reaching Ionia, Ivern and his clan paved their way by conquering a dozen coastal settlements."
What was Ivern's role in ancient Vorrijaard?,Summarize historical roles,Ivern the Cruel was a renowned warlord of ancient Vorrijaard.
What ancient gods did Ivern the Cruel follow?,Summarize historical beliefs,Ivern the Cruel followed old gods like Volibear.
How did Ivern's early life in the Freljord contrast with his later actions in Ionia?,Connect historical context with actions,"While Ivern's early life in Freljord involved following ancient warlords, his actions in Ionia were characterized by conquest and facing resistance from Vastayans."
What was the nature of the conflict Ivern engaged in with the Vastayans in Ionia?,Explain conflict context with related characters,Ivern engaged in conflict with the Vastayans in Ionia as they resisted his clan's conquest of their coastal settlements.
What does 'Ivern the Cruel' imply about his relationship with his family?,Test understanding of alias vs. personal relationships,The alias 'Ivern the Cruel' refers to his past as a warlord and does not specifically detail his relationship with his family.
Is Daisy Ivern's older brother?,Test entity resolution for familial relationships,"Daisy is Ivern's pet, not his older brother."
What are Janna's primary weapons?,List of Janna's weapons.,"Wind Magic, Staff"
In which regions has Janna been present?,List of regions associated with Janna.,"Shurima, Zaun"
Who are some characters related to Janna?,List of characters associated with Janna.,"Ekko, Jinx, Nilah, Urgot, Vi, Volibear, Tahm Kench"
What are Janna's occupations?,List of Janna's roles.,"Zaun's Guardian, Elemental Spirit of Wind, Spirit of Wisdom and Harmony"
Describe Janna's nature as a spirit.,Nature and characteristics of Janna as a spirit.,"Janna is an elemental spirit of wind, associated with wisdom and harmony. She is described as a guardian and is revered by seafarers and others who pray to the winds."
What is the ancient Shuriman meaning of Janna's true name?,Etymology and historical context of Janna's name.,"Jan'ahrem, her ancient Shuriman name, means 'guardian'."
What signs were said to precede heavy winds or storms according to old tales?,Folklore and anecdotal evidence related to Janna and weather.,"Old tales mention seafarers spotting a bright blue bird before heavy winds, and hearing a whistling in the air right before a storm."
What is Janna's species and place of origin?,Janna's biological/spiritual classification and birthplace.,Janna is a Spirit God and originated from ancient Shurima.
"How does Janna, as Zaun's Guardian, interact with or influence characters like Ekko who also operate in Zaun?","Janna's role as Zaun's Guardian and her relationship with other Zaun inhabitants like Ekko, considering lore and regional context.","As Zaun's Guardian, Janna provides spiritual protection and guidance, influencing the city's inhabitants and fate, which would implicitly affect characters like Ekko who are central to Zaun's narrative."
Explain Janna's connection to Shurima and how her elemental spirit nature manifests across different regions like Zaun.,"Janna's origins in Shurima and her manifestation as a spirit in other regions, specifically Zaun.","Janna originated in ancient Shurima and is an elemental spirit of wind. Her manifestations, like guiding winds and appearing as a blue bird, are seen by seafarers and those who pray to the winds, suggesting her influence extends beyond her origin, as seen by her role in Zaun."
Is Janna the older sister of any known champions?,"Checking for sibling relationships, specifically older sister, involving Janna.",There is no information indicating Janna is the older sister of any known champions.
Was Janna ever considered a traitor by her people?,Evaluating if Janna has a history of betrayal or is perceived as a traitor in lore.,"Janna is revered as a guardian and spirit of wisdom, and there is no information suggesting she has ever been considered a traitor."
What is Jarvan IV's primary weapon?,Weapon,Drakebane
What is Jarvan IV's region of origin?,Place of origin,"Great City, Demacia"
Who is Jarvan IV's father?,Family,Jarvan Lightshield III
Who was Jarvan IV's mentor and surrogate uncle?,Family,Xin Zhao
Describe Jarvan IV's early life and upbringing.,Early Life,"Jarvan IV received the finest education and was taught Demacian virtues like charity, duty, and service to his people."
What was the circumstance of Jarvan IV's mother's death?,Early Life,"Jarvan IV's mother, Lady Catherine, died in childbirth."
What Demacian virtues was Prince Jarvan taught?,Early Life,"Prince Jarvan was taught charity, duty, and service to his people."
Is Jarvan IV alive?,Status,Alive
How has Demacia influenced Jarvan IV's upbringing and his role as King?,"Early Life, Occupation","Demacia's virtues shaped Jarvan IV's upbringing, preparing him for his role as King, emphasizing charity, duty, and service to his people."
"Considering Xin Zhao's role as Jarvan IV's mentor, what does this imply about Demacian culture?","Family, Early Life","Xin Zhao's mentorship of Jarvan IV, a prince, suggests Demacian culture values martial prowess and loyalty, and may integrate skilled individuals from outside the immediate royal family into positions of influence and guidance."
Who is Jarvan IV's anh trai?,Family,Jarvan IV does not have an elder brother mentioned in the provided data.
Who is the traitor mentioned in relation to Jarvan IV?,Family,There is no mention of a traitor in relation to Jarvan IV in the provided data.
What weapons has Jax been known to wield?,Jax's weaponry,"Brazier-Stave, 'The Light of Icathia', Icathian Axe-Headed Polearm, Sword"
Which regions are associated with Jax?,Jax's geographical affiliations,"Runeterra, Icathia, Shurima"
List characters related to Jax.,Jax's connections,"Bel'Veth, Zilean, Nasus, Renekton, Gragas, Fiora, Breshi, Fireth, Chaska, Pesh, Trisk"
Who was Jax's father?,Jax's family,Rynx Icath'un
Describe Jax's early life in Icathia.,Jax's upbringing and early experiences,"Saijax Cail-Rynx Icath’un was born and raised in Icathia, a vassal-state of the Shuriman Empire, where he heard stories of the Kohari and harbored resentment towards the Empire."
What were Jax's feelings towards the Shuriman Empire?,Jax's historical perspective and emotions,Jax and the people of Icathia harbored resentment towards the Shuriman Empire because it had taken over their nation.
"What does the term ""Kohari"" refer to in Jax's background?",Lore terminology and cultural context,The Kohari were a group of heroes who served the Mage King of Icathia before it was taken over by the Shuriman Empire. They committed ritual suicide upon their leader's defeat.
Where does Jax currently reside?,Jax's present location,"Jax's current residence is unknown, as he has no fixed abode."
How did the Shuriman Empire's actions in ancient times affect Jax's upbringing in Icathia?,Combined lore and historical events affecting Jax in Icathia.,"The Shuriman Empire's conquest of Icathia and the subsequent parading of the Mage King and Kohari fueled resentment in Jax and his people, shaping his early life."
What is the significance of the Kohari's ritual suicide for Jax's heritage from Icathia?,"Connecting Icathian traditions, the Kohari, and Jax's heritage.","The Kohari's customary ritual suicide after their leader's defeat was a significant part of Jax's Icathian heritage, a tradition his father told him stories about, reflecting the deep-seated customs and warrior ethos of his people."
Tell me about Jax's brother.,Testing generic familial terms.,Jax's parents were Rynx Icath'un and Cail Icath'un. There is no mention of a brother in the provided data.
Who was the primary betrayer of Icathia?,"Identifying antagonist based on ""betrayer"" term.","The Shuriman Empire is described as having taken over Icathia, leading to resentment from the Icathian people. They also defeated Icathia's Mage King."
What are Jayce's primary weapons?,Jayce's Arsenal,"Jayce's primary weapons include the Mercury Hammer, Mercury Cannon, Hextech Capacitor, and Acceleration Gate."
In which region does Jayce primarily operate?,Jayce's Home Region,Jayce primarily operates in Piltover.
Who is Jayce's romantic interest?,Jayce's Personal Relationships,Jayce's romantic interest is Mel Medarda.
List some characters related to Jayce.,Jayce's Social Circle,"Characters related to Jayce include Viktor, Heimerdinger, Caitlyn, Mel, Ekko, Vi, Jinx, Ambessa, and Silco."
What inspired Jayce to pursue hextech?,Jayce's Motivation for Hextech,"Jayce was inspired to pursue hextech after being saved by a mage during a snowstorm and receiving a runic crystal, which showed him the wonders of magic and sparked his desire to harness it through science."
Describe Jayce's early life and family background.,Jayce's Early Life and Family,"Jayce was born to House Talis, renowned toolmakers. His father passed away, leaving the family hammer business to him and his mother Ximena. He later abandoned the business to pursue arcane research."
What was Jayce's role in Piltover after becoming its defender?,Jayce's Role in Piltover,"As Piltover's Defender and a Councilor, Jayce championed progress and hextech, often clashing with those who feared or opposed its advancement, and was instrumental in developing the Hexcore."
What happened to Jayce at the end of Arcane Act 2?,Jayce's Fate in Arcane,Jayce was seemingly disintegrated along with the Hexcore.
How did Jayce's ambition in Piltover lead to conflict with Silco's vision?,Jayce vs. Silco Ideological Conflict,"Jayce's ambition for a progressive, hextech-powered Piltover directly opposed Silco's vision for Zaun's independence and dominance, leading to escalating conflicts between the two regions and their ideologies."
What is the significance of the runic crystal Jayce received in his development as an inventor in Piltover?,Runic Crystal's Impact on Jayce's Invention,"The runic crystal given to Jayce by a mysterious mage sparked his fascination with magic and motivated him to develop hextech, a fusion of science and arcane power, which became central to his identity as an inventor and defender of Piltover."
Did Jayce have a brother who helped him invent the Mercury Hammer?,Jayce's Family and Inventions,"The provided lore does not mention Jayce having a brother who helped him invent the Mercury Hammer. His father passed away when he was young, and his mother Ximena was present."
Who was the traitor that betrayed Jayce and his mother in Piltover?,Jayce's Family Betrayal,"The provided lore does not mention any traitor who betrayed Jayce or his mother. His primary conflicts were with external factions like Silco's, not internal betrayals of that nature."
List all known weapons used by Jinx.,Weapons and equipment.,"Jinx uses Pow-Pow, Fishbones, Rhinogun, Pistol, Zapper, Chompers, and Shimmer."
What region is Jinx from?,Geographical origin.,Jinx is from Zaun.
Who is Jinx's adoptive father?,Family relationships.,Silco is Jinx's adoptive father.
List Jinx's known family members.,Familial connections.,"Jinx's known family members include her adoptive father Silco, adoptive brothers Mylo and Claggor, biological parents Felicia and Connol, and her older sister Vi. She also had a chosen sister, Isha."
Describe Jinx's early life and her parents' occupation.,Psychological and historical background.,"Jinx, born Powder, had parents Felicia and Connol who were miners in Zaun."
What happened to Jinx's biological parents?,Historical events and family tragedy.,"Jinx's biological parents, Felicia and Connol, were killed during an uprising against Piltover."
What was Jinx's primary motivation for participating in the uprising?,Psychological and historical motivations.,"The provided lore snippet implies she was present with her family during the uprising initiated by Vander and Silco, seeking a better life for Zaunites."
"How did Jinx's relationship with her older sister, Vi, begin?",Character history and relationships.,"Vi was very protective of Powder (Jinx) from a young age, reassuring her that no monster would get her as long as Vi was around."
"Explain Jinx's role in Zaun's conflict with Piltover, referencing her parents' fate.","Zaun-Piltover conflict, family history.","Jinx, as Powder, witnessed the violent suppression of a Zaunite uprising, which resulted in her parents' death, fueling her anarchic actions against Piltover."
How did the events of the uprising shape Jinx's perception of authority and family?,Psychological impact of trauma and societal conflict.,"Witnessing the massacre of Zaunites, including her parents, during an uprising against Piltover likely instilled a deep distrust of authority and a complex relationship with familial figures."
Describe the protective actions of Jinx's older sister.,Character actions during a historical event.,"Jinx's older sister, Vi, was very protective of Powder (Jinx), reassuring her that no monster would get her as long as she was around."
Who was the main betrayer during the Zaunite uprising?,Identification of specific roles in historical events.,The provided lore does not explicitly name a betrayer within the Zaunite uprising; hundreds of Zaunites were massacred by enforcers.
What weapon does K'Sante wield?,Weapon details,Ntofos
Where is K'Sante's place of origin?,Origin details,Nazumah
In which region is K'Sante primarily associated?,Region details,Shurima
Who was K'Sante's former lover mentioned in his lore?,Relationship details,Tope
Describe K'Sante's training to hunt the cobra-lion.,Training and hunting,"K'Sante and Tope trained to slay the cobra-lion, but struggled with its regenerating hide."
What kind of monsters did Xerath create that posed a threat?,Xerath's magical creations,Xerath created Baccai monsters by fusing Shuriman fauna.
